<?xml version="1.0"?>
<xs:schema xmlns:xs="http://www.w3.org/2001/XMLSchema"
xmlns="http://www.w3schools.com"
elementFormDefault="qualified">

	<xs:element name="meterreadings">
		<xs:complexType>
			<xs:sequence>
				<xs:element name="meterreading" maxOccurs="unbounded">
					<xs:complexType>
						<xs:sequence>
							<xs:element name="number">
								<xs:simpleType>
									<xs:restriction base="xs:string">
										<xs:pattern value="([0-9])+"/>
										<xs:minLength value="5"/>
										<xs:maxLength value="8"/>
									</xs:restriction>
								</xs:simpleType>
							</xs:element>
							<xs:element name="reading" type="xs:positiveInteger" />
						</xs:sequence>
						<xs:attribute name="date" type="xs:string" use="required"/>
					</xs:complexType>
				</xs:element>
			</xs:sequence>

		</xs:complexType>
	</xs:element>

</xs:schema>